{
  "$schema": "https://json-schema.org/draft/2020-12/schema",
  "$id": "https://foundry.local/schemas/intake-receipt.schema.json",
  "title": "IntakeReceipt",
  "description": "Sealed intake evidence for a phase intake step: CLI checks, captured outputs, and agent assessment.",
  "type": "object",
  "required": [
    "schema_version",
    "receipt_id",
    "run_id",
    "timestamp",
    "step_id",
    "status",
    "checks"
  ],
  "additionalProperties": false,
  "properties": {
    "schema_version": { "type": "string", "const": "2.2.0" },
    "receipt_id": { "type": "string", "format": "uuid" },
    "run_id": { "type": "string", "format": "uuid" },
    "timestamp": { "type": "string", "format": "date-time" },
    "step_id": { "type": "string", "minLength": 1 },
    "status": {
      "type": "string",
      "enum": ["passed", "blocked", "failed"]
    },
    "checks": {
      "type": "array",
      "minItems": 1,
      "items": {
        "type": "object",
        "required": ["id", "status"],
        "additionalProperties": false,
        "properties": {
          "id": {
            "type": "string",
            "minLength": 1,
            "pattern": "^[a-z][a-z0-9]*(?:-[a-z0-9]+)*$",
            "description": "Catalog check id from flows/implementation/registry.yaml flow.checks (kebab-case), e.g. validate-manifest."
          },
          "status": {
            "type": "string",
            "enum": ["pass", "fail", "not_applicable"],
            "description": "Same vocabulary as flow.checks and check.recorded ledger events."
          },
          "summary": { "type": "string" },
          "evidence": { "type": "object" }
        }
      }
    },
    "agent_assessment": {
      "type": "object",
      "additionalProperties": true,
      "properties": {
        "summary_markdown": {
          "type": "string",
          "description": "Short verdict line (1–2 sentences). Full assessment lives at assessment_path."
        },
        "assessment_path": {
          "type": "string",
          "description": "Run URI to the worker assessment markdown file."
        },
        "blocked_reason": { "type": "string" }
      }
    },
    "inputs": { "type": "object" }
  }
}
